name,raw_title,summary,link
Louis C.K.,LOUIS C.K.: OH MY GOD (2013) – Full Transcript,"'Oh My God' is the fifth comedy special performed by Louis C.K.. It premiered on HBO on April 13, 2013. Filmed in Phoenix, Arizona at the Celebrity Theatre",https://scrapsfromtheloft.com/2017/05/06/louis-ck-oh-my-god-full-transcript/
Louis C.K.,LOUIS C.K.: LIVE AT  THE COMEDY STORE (2015) – Transcript,"The comic puts his trademark hilarious/thought-provoking spin on finding a bat in his kitchen, seeing rats having sex, Boston accents and dead pets.",https://scrapsfromtheloft.com/2017/05/04/louis-c-k-live-at-the-comedy-store-2015-transcript/
Bill Hicks,BILL HICKS: RELENTLESS (1992) – Transcript,"Recorded in 1991 at the Centaur Theatre during the annual Just for Laughs Comedy Festival in Montreal, Canada",https://scrapsfromtheloft.com/2017/05/03/bill-hicks-relentless-1992-transcript/
Daniel Tosh,DANIEL TOSH: HAPPY THOUGHTS (2011) – Transcript,"Daniel Tosh performs in front of a live San Francisco audience in this stand-up special for Comedy Central, and touches on topics ranging from sports and pop culture, to religion and politics",https://scrapsfromtheloft.com/2017/04/30/daniel-tosh-happy-thoughts-2011-transcript/
Patrice O'Neal,PATRICE O’NEAL: ELEPHANT IN THE ROOM (2011) – Transcript,"Full transcript of 'Elephant in the Room', stand up special by comedian Patrice O'Neal, released by Comedy Central. It premiered on February 19, 2011",https://scrapsfromtheloft.com/2017/04/28/patrice-oneal-elephant-in-the-room-2011-full-transcript/
Katt Williams,KATT WILLIAMS: LIVE (2006) – Full Transcript,"(POLICE SIREN BLARING) (POLICE RADIO CHATTERING) (CROWD CLAMORING) CHRIS: Thank you. 100.9 the Wiz. Blazing hip hop and R and B. Jamming in the building right now. Man, it's just an honor to have this guy just stop by just to say hi and say what's up to Cincinnati. My [...]",https://scrapsfromtheloft.com/2017/04/27/katt-williams-live-2006-full-transcript/
Richard Pryor,RICHARD PRYOR: LIVE IN CONCERT (1979) – Full Transcript,"Filmed in Long Beach, California on December 10, 1978 [Distant traffic sounds] [Distant car motor] [Squeaking brakes] [Car door open] [Car door slam] [Car door open] [Car door slam] [Crowd murmur & distant cheers] [Door slam] [Cheering and applause] Richard Pryor: Thank you. Thank you. Thank you. Hey, thank you. [...]",https://scrapsfromtheloft.com/2017/04/27/richard-pryor-live-concert-1979-full-transcript/
Richard Pryor,RICHARD PRYOR: LIVE ON THE SUNSET STRIP (1982) – Full Transcript,"Comedy legend Richard Pryor touches on all subjects, ranging from women to his trip to Africa, and even his scandalous past: the brothel run by his grandmother, his cocaine addiction, and the infamous incident in which he lit himself on fire. ",https://scrapsfromtheloft.com/2017/04/26/richard-pryor-live-sunset-strip-1982-full-transcript/
Trevor Noah,TREVOR NOAH: AFRAID OF THE DARK (2017) – Full Transcript,"The ""Daily Show"" host ponders the perils of naming countries, how traffic lights turn New Yorkers invincible and why you shouldn't drink in Scotland",https://scrapsfromtheloft.com/2017/04/22/trevor-noah-afraid-dark-2017-full-transcript/
Jim Jefferies,JIM JEFFERIES: BARE (2014) – Full Transcript,"Nothing is sacred in this show from Australian comic Jim Jefferies, whether it’s the mother of his child, auditioning disabled actors, or gun control.",https://scrapsfromtheloft.com/2017/04/21/jim-jefferies-bare-2014-full-transcript/
Dave Chappelle,DAVE CHAPPELLE: DEEP IN THE HEART OF TEXAS (2017) – Full Transcript,"Chappelle gets real about racially charged run-ins, celebrity scandals and fatherly dilemmas in a searing stand-up set at Austin's Moody Theatre",https://scrapsfromtheloft.com/2017/04/20/dave-chappelle-deep-heart-texas-2017-full-transcript/
Tom Segura,TOM SEGURA: MOSTLY STORIES (2016) – Full Transcript,"Comedian Tom Segura savors wondrous strip-club names, basks in foul-mouthed heckling and shares life's dirty truths in an irreverent stand-up special",https://scrapsfromtheloft.com/2017/04/19/tom-segura-mostly-stories-2016-full-transcript/
Bill Burr,BILL BURR: LET IT GO (2010) – Full transcript,"Burr's special 'Let it Go', recorded at The Fillmore in San Francisco and premiered on Comedy Central on September 18, 2010",https://scrapsfromtheloft.com/2017/04/19/bill-burr-let-it-go-2010-full-transcript/
George Carlin,GEORGE CARLIN: JAMMING IN NEW YORK (1992) – Testo italiano completo,"Ciao, grazie. Grazie. Grazie. Grazie molte. Grazie. Grazie a tutti. Grazie a tutti. Grazie e un saluto a New York. Ciao New York e grazie. Si'. Ok. E' passato un po' di tempo dall'ultima volta che sono stato qui... ...e nel frattempo sono successe un paio di cose. Volevo parlare [...]",https://scrapsfromtheloft.com/2017/04/12/george-carlin-jamming-new-york-testo-italiano-completo/
George Carlin,GEORGE CARLIN: YOU ARE ALL DISEASED (1999) – Testo italiano completo,"Siete gentili, grazie! Grazie mille, lo apprezzo. Grazie mille, grazie a tutti, grazie! Lo apprezzo... Grazie, grazie... Allora, lasciate che vi chieda una cosa... ...lasciate che vi chieda, come state tutti stasera, eh? Ottimo, be', andate affanculo! Cerco solo di farvi sentire a casa vostra. Ora, sentite, sono stato qua [...]",https://scrapsfromtheloft.com/2017/04/12/george-carlin-diseased-1999-testo-italiano-completo/
George Carlin,GEORGE CARLIN: IT’S BAD FOR YA! (2008) – Testo italiano completo,"Grazie, grazie, grazie! Mi piacerebbe iniziare... Mi piacerebbe... grazie, grazie! Mi piacerebbe iniziare dicendo: affanculo Lance Armstrong! Affanculo lui e le sue palle e le sue biciclette e i suoi steroidi e le sue maglie gialle... ...e la stupida espressione vuota sul suo volto, sono stanco di quello stronzo. E [...]",https://scrapsfromtheloft.com/2017/04/12/george-carlin-bad-2008-testo-italiano-completo/
Jim Jefferies,JIM JEFFERIES: FREEDUMB (2016) – Full Transcript,"Jim Jefferies talks about family life and challenges the idea of American freedom live on stage in Nashville, Tennessee",https://scrapsfromtheloft.com/2017/04/11/jim-jefferies-freedumb-2016-full-transcript/
Eddie Murphy,EDDIE MURPHY: DELIRIOUS (1983) – Full Transcript,"Transcript of Eddie Murphy's 'Delirious', stand-up comedy HBO special released August 30, 1983.",https://scrapsfromtheloft.com/2017/04/11/eddie-murphy-delirious-full-transcript/
Dave Chappelle,DAVE CHAPPELLE: THE AGE OF SPIN (2017) – Full Transcript,"This is Dave. He tells dirty jokes for a living. That stare is where most of his hard work happens. It signifies a profound train of thought, the alchemist's fire that transforms fear and tragedy into levity and livelihood. Dave calls that look ""the trance."" ♪ Play me ♪ ♪ [...]",https://scrapsfromtheloft.com/2017/04/11/dave-chappelle-age-spin-2017-full-transcript/
George Carlin,GEORGE CARLIN: BACK IN TOWN (1996) – Full transcript,"Back in Town is George Carlin's 15th album and ninth HBO special. It was also released on CD on September 17, 1996. This was also his first of many performances at the Beacon Theater in New York City ""Abortion"" Why, why, why, why is it that most of the people [...]",https://scrapsfromtheloft.com/2017/04/10/george-carlin-back-town-1996-full-transcript/
Louis C.K.,LOUIS C.K.: 2017 – Full transcript,"Louis C.K. muses on abortion, religion, eternal love, giving dogs drugs, email fights, teachers and more in a live performance from Washington, D.C.",https://scrapsfromtheloft.com/2017/04/08/louis-c-k-2017-full-transcript/
George Carlin,GEORGE CARLIN: JAMMING IN NEW YORK (1992) – Full Transcript,"Jammin' in New York is George Carlin's 14th album and eighth HBO special, recorded on April 24 and 25, 1992, at the Paramount Theater, on the grounds of Madison Square Garden in New York City. ""Rockets and Penises in the Persian Gulf"" Thank you and hello New York! Okay, it’s [...]",https://scrapsfromtheloft.com/2017/04/06/george-carlin-jamming-new-york-1992-full-transcript/
George Carlin,GEORGE CARLIN: YOU ARE ALL DISEASED (1999) – Full Transcript,"You Are All Diseased is the 16th album and 11th HBO live broadcast stand-up special by comedian George Carlin, recorded on February 6, 1999 at the Beacon Theater in New York City",https://scrapsfromtheloft.com/2017/04/06/george-carlin-you-are-all-diseased-transcript/
Jim Jefferies,JIM JEFFERIES ON GUN CONTROL [FULL TRANSCRIPT],Comedian Jim Jefferies breaks down the absurdity of America's obsession with guns in his Netflix special 'Bare',https://scrapsfromtheloft.com/2017/04/01/jim-jefferies-gun-control-full-transcript/
George Carlin,GEORGE CARLIN: COMPLAINTS AND GRIEVANCES (2001) Full Transcript,"Full transcript of Complaints and Grievances, HBO comedy special by stand-up comedian George Carlin. It was recorded on November 17, 2001.",https://scrapsfromtheloft.com/2017/03/29/george-carlin-complaints-grievances/
George Carlin,GEORGE CARLIN: LIFE IS WORTH LOSING (2006) – Full transcript,"George Carlin returns to the stage in Life is Worth Losing, his 13th live comedy stand-up special, performed at the Beacon Theatre in New York City for HBO",https://scrapsfromtheloft.com/2016/12/28/george-carlin-life-is-worth-losing-transcript/
George Carlin,George Carlin: It’s Bad For Ya (2008) Full transcript,"Full transcript of It's Bad for Ya, final HBO comedy special by stand-up comedian George Carlin. It was televised live on March 1, 2008 on HBO.",https://scrapsfromtheloft.com/2016/11/10/george-carlin-its-bad-for-ya/
